{
  "$schema": "https://json-schema.org/draft/2020-12/schema",
  "$id": "https://rshiri.github.io/BRICKONOMY/carousel/schema.json",
  "title": "Brickonomy Instagram carousel payload",
  "description": "One LEGO set's market snapshot, rendered into a 4:5 (1080x1350) Instagram carousel. All money values are USD.",
  "type": "object",
  "required": ["set", "pricing", "market", "minifigs"],
  "additionalProperties": false,
  "properties": {
    "set": {
      "type": "object",
      "required": ["number", "name", "year", "pieces"],
      "additionalProperties": false,
      "properties": {
        "number": { "type": "string", "pattern": "^[0-9A-Za-z]+(-[0-9]+)?$", "description": "Set number, e.g. \"76269\"." },
        "name":   { "type": "string", "minLength": 1 },
        "theme":  { "type": "string", "description": "Optional theme line shown under the name." },
        "year":   { "type": "integer", "minimum": 1949, "maximum": 2100 },
        "pieces": { "type": "integer", "minimum": 0 },
        "image_url": {
          "type": "string",
          "description": "http(s) URL, file:// URL, or a local path. Omit to use BrickLink's catalog image (img.bricklink.com/ItemImage/SN/0/<number>-1.png). A generated placeholder is drawn if the picture cannot be fetched."
        }
      }
    },
    "pricing": {
      "type": "object",
      "required": ["msrp", "new_value", "used_value"],
      "additionalProperties": false,
      "properties": {
        "currency":   { "type": "string", "enum": ["USD", "ILS", "EUR", "GBP"], "default": "USD", "description": "Currency of every money field in this payload (pricing, market.previous_new_value, minifigs[].used_price). Slides always show USD." },
        "fx_rate":    { "type": "number", "exclusiveMinimum": 0, "description": "Units of `currency` per 1 USD (e.g. 3.02 for ILS). Required for accurate conversion when currency is not USD; a built-in fallback is used otherwise." },
        "msrp":       { "type": "number", "minimum": 0, "description": "Retail price, in `currency`. Displayed in USD rounded to the nearest $5." },
        "new_value":  { "type": "number", "minimum": 0, "description": "Current sealed/new market value, in `currency`. Displayed in USD rounded to the nearest $5." },
        "used_value": { "type": "number", "minimum": 0, "description": "Current used/complete market value, in `currency`. Displayed in USD rounded to the nearest $5." },
        "minifigs_used_total": {
          "type": "number", "minimum": 0,
          "description": "Combined used value of every minifigure (quantity-weighted), in `currency`. Computed from `minifigs` when omitted."
        }
      }
    },
    "market": {
      "type": "object",
      "required": ["updated_at"],
      "additionalProperties": false,
      "properties": {
        "updated_at": {
          "type": "string",
          "description": "ISO-8601 date or datetime (\"2026-09-08\" or \"2026-09-08T06:00:00Z\"). Rendered as \"Prices valid as of Sep 8, 2026\"."
        },
        "previous_new_value": {
          "type": "number", "minimum": 0,
          "description": "Last month's new value, in `pricing.currency`. Used to derive `trend` when `trend` is omitted."
        },
        "trend": {
          "type": "object",
          "required": ["direction"],
          "additionalProperties": false,
          "properties": {
            "direction":  { "type": "string", "enum": ["up", "down", "flat"] },
            "change_pct": { "type": "number", "description": "Signed percent change vs last month, e.g. 4.1 or -2.5." },
            "change_usd": { "type": "number", "description": "Signed USD change vs last month." },
            "period":     { "type": "string", "default": "vs last month" }
          }
        }
      }
    },
    "minifigs": {
      "type": "array",
      "description": "Rendered 4 per slide in the order given (or by value with --sort value).",
      "items": {
        "type": "object",
        "required": ["code", "name", "used_price"],
        "additionalProperties": false,
        "properties": {
          "code":       { "type": "string", "minLength": 1, "description": "BrickLink minifig ID, e.g. \"sh0916\"." },
          "name":       { "type": "string", "minLength": 1, "description": "Character name. Long BrickLink variant descriptions are fine; the card clamps to two lines." },
          "used_price": { "type": "number", "minimum": 0, "description": "Used unit price, in `pricing.currency`. Displayed in USD rounded to the nearest $1." },
          "quantity":   { "type": "integer", "minimum": 1, "default": 1, "description": "How many of this figure the set contains (shows a x4 badge and weights the total)." },
          "image_url":  { "type": "string", "description": "http(s) URL, file:// URL or local path. Omit to use BrickLink's catalog image (img.bricklink.com/ItemImage/MN/0/<code>.png). Placeholder on failure." }
        }
      }
    },
    "branding": {
      "type": "object",
      "additionalProperties": false,
      "properties": {
        "site_name": { "type": "string", "default": "brickanalyst.en", "description": "Account name shown in the post header next to the avatar." },
        "url":       { "type": "string", "default": "", "description": "Optional website line under the handle in the footer." },
        "handle":    { "type": "string", "default": "@brickanalyst.en", "description": "Instagram handle shown in the footer watermark." },
        "avatar":    { "type": "string", "default": "assets/profile.jpg", "description": "Profile picture shown in the story ring: a path relative to carousel/ (bundled asset), relative to the payload, or a URL. Square images work best." },
        "accent":    { "type": "string", "pattern": "^#[0-9A-Fa-f]{6}$", "default": "#ee2a7b", "description": "Solid accent colour (Instagram pink by default)." },
        "gradient":  { "type": "string", "default": "linear-gradient(135deg, #f9ce34 0%, #fa7e1e 28%, #ee2a7b 58%, #6228d7 100%)", "description": "CSS gradient used for the progress bar, story rings, highlight card and gradient text. Defaults to the Instagram brand gradient." },
        "cta":       { "type": "string", "default": "Full price history on the site", "description": "Last-slide call to action." }
      }
    },
    "hook": {
      "type": "object",
      "additionalProperties": false,
      "description": "Copy for the bold lead-in slide shown before the hero (only rendered by themes that provide a hook.html; poster has one, currently). Any field left out is auto-generated from the pricing data.",
      "properties": {
        "kicker":   { "type": "string", "description": "Small badge above the image, e.g. \"Retirement watch\". Defaults to \"Price check\"." },
        "headline": { "type": "string", "description": "The big bold hook line, e.g. \"When will the Avengers Tower retire?\". Defaults to a short stat line like \"+1% since 2023\"." },
        "sub":      { "type": "string", "description": "Small line under the headline. Defaults to \"Swipe for the full breakdown\"." }
      }
    },
    "forecast": {
      "type": "object",
      "required": ["year", "value"],
      "additionalProperties": false,
      "description": "Optional forward-looking price prediction, rendered as an extra closing slide (only by themes with a forecast.html; poster has one). Omit this field entirely to skip the slide -- unlike hook, there's no auto-generated fallback for a number this speculative.",
      "properties": {
        "year":        { "type": "integer", "minimum": 1949, "maximum": 2100, "description": "Year the predicted value is for." },
        "value":       { "type": "number", "minimum": 0, "description": "Predicted value, in `pricing.currency`." },
        "retire_note": { "type": "string", "description": "Short line about expected retirement, e.g. \"Still active -- expected to stay in stores until 2028\"." },
        "caption":     { "type": "string", "description": "Optional longer analysis paragraph. When set, it becomes the main content of the slide (a text-heavy closer) instead of the year/value stat card. Blank lines split it into separate paragraphs." },
        "highlight_label": { "type": "string", "description": "Optional small lead-in line above the highlight value, e.g. \"Predicted price right after retirement:\"." },
        "highlight_value": { "type": "string", "description": "Optional short bold takeaway shown big under the caption, e.g. \"1.2x more!\". Requires highlight_label to make sense, but either can be set alone." }
      }
    },
    "moc": {
      "type": "object",
      "required": ["creator", "title"],
      "additionalProperties": false,
      "description": "Optional bonus slide calling out a notable fan-made alternate build (MOC) for this set, rendered after the minifig pages and before forecast (only by themes with a moc.html; poster has one). Omit this field entirely to skip the slide.",
      "properties": {
        "creator":     { "type": "string", "minLength": 1, "description": "MOC designer's name/handle, e.g. \"Ransom_Fern\"." },
        "title":       { "type": "string", "minLength": 1, "description": "What the rebuild is, e.g. \"Iron Man Mark 44 Hulkbuster - Alternate Build\"." },
        "pieces":      { "type": "integer", "minimum": 0, "description": "Part count of the MOC, if known." },
        "price":       { "type": "number", "minimum": 0, "description": "Price of the instructions in USD, if they're sold." },
        "stock_parts": { "type": "boolean", "default": false, "description": "True if the MOC is buildable entirely from the original set's own parts, no extra pieces needed -- worth calling out." },
        "note":        { "type": "string", "description": "Short line of color/context, e.g. a notable review quote or what makes it stand out." }
      }
    }
  }
}
